ID,Vendor,Title,Type,Variant Price,custom.moyenne_description,custom.taille,custom.ingredients,custom.routine,custom.info_bestseller,custom.info_cruelty_free,custom.info_vegan,custom.info_clean_beauty,custom.tout_type,custom.peau_grasse,custom.peau_mature,custom.peau_seche,custom.peau_sensible,custom.peau_acneique,updated_at,Variant Compare Price
9909495628117,APRILSKIN,Carrotene IPMP Calming & Hydrating Sheet Mask,P,3.9,"Formulé avec du bêta-carotène, il élimine efficacement les bactéries et impuretés responsables de l'acné et offre d'excellents effets anti-inflammatoires.",20 gr,"Water, Butylene Glycol, Glycerin, Dipropylene Glycol, 1,2-Hexanediol, Hydroxyacetophenone, Carbomer, Butylene Glycol, Daucus Carota Sativa (Carrot) Root Extract, Allantoin, Arginine, Hydroxyethylcellulose, Xanthan Gum, Polyglyceryl-10 Laurate, Ethylhexylglycerin, Disodium EDTA, Panthenol, Eucalyptus Globulus Leaf Oil, o-Cymen-5-ol, Cyclodextrin, Madecassoside, Centella Asiatica Extract, Helianthus Annuus (Sunflower) Seed Oil, Beta-carotene",5,,True,True,,,,,,True,,2025-06-21T11:35:46+02:00,
9717165719893,SOME BY MI,Super Matcha Pore Care Starter Kit,P,24.9,"Le Kit Super Matcha est un excellent choix pour ceux qui souhaitent démarrer une routine de soins complète et efficace avec des produits formulés pour réguler l'excès de sébum, purifier la peau et favoriser un éclat naturel.",,"[Super Matcha Pore Clean Clay Mask] Water, Kaolin (120,000 ppm), Glycerin, Camellia Sinensis Leaf Water (102,000 ppm), Titanium Dioxide (CI 77891), Bentonite, Magnesium Aluminum Silicate, Caramel, Chamaecyparis Obtusa Leaf Extract, Silica, Manicouagan Clay (1,000 ppm), Camellia Sinensis Leaf (6,000 ppm), Camellia Sinensis Leaf Powder(4,000 Ppm), Houttuynia Cordata Powder, Centella Asiatica Extract, Camellia Sinensis Leaf Extract (100 ppm), Salix Alba Salix Alba (Willow) Bark Extract, Rosa Rugosa Leaf Extract, Mellissa Officinalis Leaf Extract, Water(Glacier Water), Melaleuca Alternifolia (Tea Tree) Leaf Water, Water (Carbonated Water), Allantoin, Madecassic Acid, Asiaticoside, Asiatic, Acid, Capryloyl Salicylic Acid, Butylene Glycol, Xanthan Gum, Polyvinyl Alcohol, 1,2-hexanediol, Benzyl Glycol, Ethylhexylglycerin, Rasberry Ketone, CI 42090.

[Super Matcha Pore Tightening Toner] Camellia Sinensis Leaf Extract, Propanediol, Salix Alba (Willow) Bark Extract, Niacinamide, 1,2-Hexanediol, Lithium Magnesium Sodium Silicate, Calcium Chloride, Silica, Sodium Cirtrate, Polyglycerin-10 Laurate, Polyglycerin-10 Myristate, Ethylhexylglycerin, Adenosine, Glycerin, Citric Acid, Disodium EDTA, Fragrance, Centella Asiatica Extract, Glacier Water, Carbonated Water,Melaleuca Alternifolia (Tea Tree) Leaf Water, Houttuynia Cordata Extract, Butylene Glycol, Madecassoside, Water, Asiaticaside, Asiatic Acid, Madecassic Acid, Glyceryl Caprylate, Hexyl Cinnamal

[Super Matcha Pore Tightening Serum] Camellia Sinensis Leaf Extract (93%), Niacinamide, 1,2-Hexanediol, Water, Butylene Glycol, Polyglyceryl-10 Laurate, Polyglyceryl-10 Myristate, Glycerin, Acrylates/C10-30 Alkyl Acrylate Crosspolymer, Arginine, Ethylhexyiglycerin, Adenosine, Disodium EDTA, Fragrance, Melia Azadirachta Leaf Extract, Melia Azadirachta Flower Extract, Melissa Officinals Extract, Citrus Aurantium Dulcis (Orange) Flower Extract, Chaenomeles Sinensis Fruit Extract, Oenothera Biennis (Evening Primrose) Flower Extract, Pueraria Lobata Root Extract, Pinus Palustris Leaf Extract, Ulmus Davidiana Root Extract, Centella Asiatica Extract, Melaleuca Alternifolia (Tea Tree) Leaf Water, Salix Alba (Willow) Bark Extract, Madecassoside, Houttuynia Cordata Extract, Lactobionic Acid, Asiaticoside, Asiatic Acid, Madecassic Acid, Sodium Hyaluronate, Glyceryl Caprylate, Hexyl Ginnamal, Limonene, Linalool

[Super Matcha Pore Clean Cleansing Gel] Camellia Sinensis Leaf Water (62%), Glycerin, Purified Water, Potassium Cocoyl Glycinate, Lauryl Glucoside, Coco Glucoside, Acrylate Co-polymer, Sodium Cocoyl Isethionate, 1,2-Hexanediol, Salix Alba Bark Water, Salix Alba Bark Extract, Glacial Water, Carbonated Water, Centella Asiatica Extract, Centella Asiatica Leaf Extract, Melia Azadirachta Leaf Extract, Melia Azadirachta Flower Extract, Calamine, Camellia Sinensis Leaf Powder (50ppm), Melaleuca Alternifolia Leaf Powder, Butylene Glycol, Sodium Hyaluronic Acid, Allantoin, Madecassic Acid, Asiaticoside, Asiatic Acid, Madecasoside, Cocos Nucifera Oil, Coco Caprylate/Caprate, Capryl Glycol, Glyceryl Undecylenate, Polyglyceryl-10 Myristate, Potassium Cetyl Phosphate, Lauric Acid, Mannan, Lactobionic Acid, Citric Acid, Triethoxycaprylylsilane, Methylpropanediol, Benzylglycol, Ethylhexylglycerin, Raspberry Ketone, Fragrance",,,,,,,True,,,,,2025-06-21T11:40:23+02:00,
9751265444181,TIRTIR,Mask Fit Red Cushion - 17N Vanilla,M,29.9,"Le Mask Fit Red Cushion de TIRTIR est ainsi le choix parfait pour celles qui recherchent un maquillage léger mais couvrant, tout en offrant soin et protection à leur peau, le tout avec une protection solaire intégrée.",,"Water, Titanium Dioxide (CI 77891), Cyclopentasiloxane, Dimethicone, Trimethylsiloxysilicate, Propanediol, Diphenylsiloxy Phenyl Trimethicone, Niacinamide, PEG-10 Dimethicone, Isododecane, Iron Oxides (CI 77492), Polyglyceryl-3 Polydimethylsiloxyethyl Dimethicone, PEG/PPG-18/18 Dimethicone, 1,2-Hexanediol, Octyldodecanol, Magnesium Sulfate, Disteardimonium Hectorite, Aluminum Hydroxide, Stearic Acid, Iron Oxides (CI 77491), Polyhydroxystearic Acid, Triethoxycaprylylsilane, Alumina, Potassium Sorbate, Polyglyceryl-4 Isostearate, Fragrance(Parfum), Neopentyl Glycol Diethylhexanoate, Iron Oxides (CI 77499), Isopropyl Titanium Triisostearate, Adenosine, Trisodium Ethylenediamine Disuccinate, Polymethyl Methacrylate, Haematococcus Pluvialis Oil, Butylene Glycol, Glycerin, Dipropylene Glycol, Sodium Palmitoyl Proline, Cetearyl Dimethicone/Vinyl Dimethicone Crosspolymer, Hibiscus Sabdariffa Flower Extract, Astaxanthin, Rosa Rugosa Flower Extract, Pancratium Maritimum Extract, Nymphaea Alba Flower Extract, Propolis Extract",,,,,,,,,,,,2025-06-21T12:25:29+02:00,
9732486332757,BEAUTY OF JOSEON,Dynasty Cream 100 ml,P,34.9,"La Dynasty Cream de Beauty of Joseon, enrichie en eau de son de riz et en racine de ginseng, hydrate, régule le sébum et illumine la peau, lui offrant un fini radieux et naturel.",100 ml,"Aqua, Glycerin, Hydrogenated Polydecene, 1,2-Hexanediol, Niacinamide, Squalane, Butylene Glycol, Propanediol, Butylene Glycol Dicaprylate/Dicaprate, Cetearyl Olivate, Sorbitan Olivate, Ammonium Acryloyldimethyltaurate/VP Copolymer, Xanthan Gum, Panax Ginseng Root Water, Acrylates/C10-30 Alkyl Acrylate Crosspolymer, Glyceryl Acrylate/Acrylic Acid Copolymer, Tromethamine, Carthamus Tinctorius Seed Oil, Hydrogenated Coconut Oil, Oryza Sativa Bran Water, Ethylhexylglycerin, Adenosine, Caprylic/Capric Triglyceride, Disodium EDTA, Hyaluronic Acid, Hydrolyzed Hyaluronic Acid, Sodium Hyaluronate, Honey Extract, Ceramide NP, Hydrogenated Lecithin, Coptis Japonica Root Extract, Raphanus Sativus Seed Extract, Lycium Chinense Fruit Extract, Theobroma Cacao Seed Extract, Phellinus Linteus Extract, Dextrin, Scutellaria Baicalensis Root Extract",9,,True,,,True,,,,,,2025-06-21T13:55:21+02:00,
9845102248277,MARY & MAY,Vegan Niacinamide Panthenol Sun Cushion SPF50+ PA++++,P,28.9,"Ce SPF offre non seulement une protection efficace contre les rayons UVA et UVB, mais présente plusieurs avantages pour votre peau. Il illumine votre teint, bloque la production de mélanine et améliore ainsi votre teint global.",25 gr,"Purified Water, Caprylylmethicone, Zinc Oxide, Methyltrimethicone, Butylene Glycol Dicaprylate/dicaprate, Butyloctyl Salicylate, Titanium Dioxide, Polyglyceryl-4 Diisostearate/polyhydroxy Stearate/sebacate, Propanediol, Glycerin, Niacinamide, Panthenol, Methyl Methacrylate Crosspolymer, Diisostearyl Maleate, Sodium Hyaluronate, Dimer Dilinoleyl Dimer Dilinoleate, Magnesium Sulfate, Disteadymonium Hectorite, Stearic Acid, Aluminum Hydroxide, Polyglyceryl-6 Polyricinoleate, 1,2-hexanediol, Triethoxycaprylylsilane, Sorbitan Caprylate, Glyceryl Caprylate, Caprylyl Glycol, Ethylhexylglycerin, Adenosine, Tocopherol, Fragrance",10,,True,True,True,True,,,,,,2025-06-21T14:25:29+02:00,
9815269278037,TIRTIR,Mask Fit Red Cushion - 22W Sheer Beige,M,29.9,"Le TIRTIR Mask Fit Red Cushion est donc une excellente option pour celles qui recherchent un fond de teint qui allie maquillage impeccable et soins nourrissants, tout en offrant un fini naturel et lumineux.",,,,,,,,True,,,,,,2025-06-21T14:50:22+02:00,
9811060851029,JKOSMEC,Skin Solution Firming Face Cream (Collagen),P,13.9,"Crème hydratante au collagène, adénosine et niacinamide pour traiter les premiers signes de l'âge, renforcer la peau et améliorer sa fermeté.",50 ml,"Aqua, Cetyl Ethylhexanoate, Glycerin, Butylene Glycol, Cetearyl Alcohol, Niacinamide, 1, 2-Hexanediol, Polyglyceryl-2 Stearate, Glyceryl Stearate, Stearyl Alcohol, Hydroxyacetophenone, Hydrogenated Polydecene, Vinyl Dimethicone, Synthetic Beeswax, Diisostearyl Malate, Butyrospermum Parkii (Shea) Butter, Palmitic Acid, Tromethamine, Stearic Acid, Acrylates/C10-30 Alkyl Acrylate Crosspolymer, Carbomer, Parfum, Adenosine, Hydrolyzed Collagen, Sodium Hyaluronate",9,,,,,True,,True,,,,2025-06-21T15:10:36+02:00,
9720517394773,APIEU,Milk One Mask - Coffee Milk,P,2.9,"Ce masque A'pieu Coffee Milk One Pack contient de l'extrait de café pour améliorer l'élasticité et l'éclat de la peau , du collagène hydrolysé pour nourrir et prévenir le relâchement de la peau. L'extrait de lait hydrate la peau et élimine les cellules mortes et adoucissent la peau. ",21 gr,"Coffe Milk : Water, Butylene Glycol, Glycerin, Mineral Oil, PEG-40 Stearate, Cetearyl Alcohol, Stearic Acid, Sorbitan Sesquioleate, Coffea Arabica (Coffee) Seed Extract, Milk Extract, Adenosine, Hydrolyzed Collagen, Lactobacillus/Soybean Ferment Extract, Saccharomyces/Imperata Cylindrica Root Ferment Extract, Saccharomyces/Viscum Album (Mistletoe) Ferment Extract, Nelumbo Nucifera Callus Culture Extract, 1,2-Hexanediol, Sodium Hyaluronate, Ethylhexylglycerin, Caprylyl Glycol, Illicium Verum (Anise) Fruit Extract, Carbomer, Triethanolamine, Phenoxyethanol, Disodium EDTA, Fragrance.
Banana Milk : Water, Butylene Glycol, Glycerin, Mineral Oil, PEG-40 Stearate, Cetearyl Alcohol, Stearic Acid, Sorbitan Sesquioleate, Musa Sapientum (Banana) Fruit Extract, Milk Extract, Royal Jelly Extract, Lactobacillus/Soybean Ferment Extract, Saccharomyces/Imperata Cylindrica Root Ferment Extract, Saccharomyces/Viscum Album (Mistletoe) Ferment Extract, Nelumbo Nucifera Callus Culture Extract, 1,2-Hexanediol, Sodium Hyaluronate, Ethylhexylglycerin, Caprylyl Glycol, Illicium Verum (Anise) Fruit Extract, Carbomer, Triethanolamine, Phenoxyethanol, Disodium EDTA, Fragrance.
Strawberry Milk : Water/Aqua/Eau, Butylene Glycol, Glycerin, Mineral Oil, PEG-40 Stearate, Cetearyl Alcohol, Stearic Acid, Sorbitan Sesquioleate, Fragaria Chiloensis (Strawberry) Fruit Extract, Milk Extract, Pearl Extract, Lactobacillus/Soybean Ferment Extract, Saccharomyces/Imperata Cylindrica Root Ferment Extract, Saccharomyces/Viscum Album (Mistletoe) Ferment Extract, Nelumbo Nucifera Callus Culture Extract, 1,2-Hexanediol, Sodium Hyaluronate, Ethylhexylglycerin, Caprylyl Glycol, Illicium Verum (Anise) Fruit Extract, Carbomer, Triethanolamine, Phenoxyethanol, Disodium EDTA, Fragrance/Parfum.
Green Tea Milk : Water, Butylene Glycol, Glycerin, Mineral Oil, PEG-40 Stearate, Cetearyl Alcohol, Stearic Acid, Sorbitan Sesquioleate, Camellia Sinensis Leaf Extract, Milk Extract, Hamamelis Virginiana (Witch Hazel) Extract, Lactobacillus/Soybean Ferment Extract, Saccharomyces/Imperata Cylindrica Root Ferment Extract, Saccharomyces/Viscum Album (Mistletoe) Ferment Extract, Nelumbo Nucifera Callus Culture Extract, 1,2-Hexanediol, Sodium Hyaluronate, Ethylhexylglycerin, Caprylyl Glycol, Illicium Verum (Anise) Fruit Extract, Carbomer, Triethanolamine, Phenoxyethanol, Disodium EDTA, Fragrance.
Coconut Milk : Water, Butylene Glycol,Glycerin, Mineral Oil , Cocos Nucifera (Coconut) Fruit Extract , Milk Extract, PEG-40 Stearate,Cetearyl Alcohol, Stearic Acid, Sorbitan Sesquioleate, Tremella Fuciformis (Mushroom) Extract , Lactobacillus/Soybean Ferment Extract, Saccharomyces/Imperata Cylindrica Root Ferment Extract, Saccharomyces/Viscum Album (Mistletoe) Ferment Extract, Nelumbo Nucifera Callus Culture Extract, 1,2-Hexanediol, Sodium Hyaluronate, Ethylhexylglycerin, Caprylyl Glycol, Illicium Verum (Anise) Fruit Extract, Carbomer, Triethanolamine, Phenoxyethanol, Disodium EDTA, Frangance.
White Milk : Water, Butylene Glycol, Glycerin, Mineral Oil, PEG-40 Stearate, Cetearyl Alcohol, Stearic Acid, Sorbitan Sesquioleate, Milk Protein Extract, Milk Extract, Aloe Barbadensis Leaf Extract, Lactobacillus/Soybean Ferment Extract, Saccharomyces/Imperata Cylindrica Root Ferment Extract, Saccharomyces/Viscum Album (Mistletoe) Ferment Extract, Nelumbo Nucifera Callus Culture Extract, 1,2-Hexanediol, Sodium Hyaluronate, Ethylhexylglycerin, Caprylyl Glycol, Illicium Verum (Anise) Fruit Extract, Carbomer, Triethanolamine, Phenoxyethanol, Disodium EDTA, Fragrance.
",5,,,,,True,,,,,,2025-06-21T15:35:29+02:00,
9761927758165,G9 SKIN,Self Aesthetic Rose Hydrogel Lip Patch,P,3.9,"Ce patch pour les lèvres contient de l'eau de rose, de l'acide hyaluronique et du collagène.",3 gr,"Aqua, Glycerin, Dipropylène Glycol, Chondrus Crispus Powder, Butylène Glycol, Ceratonia Siliqua Gum, Xanthan Gum, Panthenol, Allantoin, Phenoxyethanol, Chlorphenesin, PEG-60 Hydrogenated Castor Oil, Rosa Centifolia Flower Water, Agar, Cyamopsis Tegon, Lactate de calcium, glucose, chlorure de potassium, parfum, EDTA disodique, CI 73360, extrait de feuille de Camellia Sinensis, extrait de feuille d'eucalyptus globulus, extrait de feuille d'Hedera Helix, extrait de fleur d'Hibiscus Sabdariffa, extrait d'eau de graine de linum Usitatissimum, extrait de fleur de linum Usitatissimum, Nelumbo Nucifera Extrait, extrait de graine de Salvia Hispanica, extrait de feuille de Pinus Sylvestris, extrait de miel, niacinamide, jus de feuille d'aloe barbadensis, citronellol, géraniol, alcool isopropylique, 1, 2-hexanediol, hexyl cinnamal, hyaluronate de sodium, collagène hydrolysé, acide citrique, sorbate de potassium Benzoate de sodium",5,,,,,True,,,,,,2025-06-21T15:55:26+02:00,
9909551858005,PERIPERA,Ink Airy Velvet #26 Well Made Nude,M,11.9,Encre à lèvres à la couleur intense et à la texture veloutée. Ses ingrédients hydratants permettent de lisser la peau tout en laissant les lèvres douces et souples.,4 gr,"Water, 2-hexanediol, Yellow 5 (CI 19140), Red Iron Oxide, Yellow Iron Oxide, Titanium Dioxide (CI 77891), Polyglyceryl-2 Triisostearate, PEG-60 Hydrogenated Castor Oil, PEG-10 Dimethicone, Iron Oxide Yellow(CI 77492), Butylene Glycol Isododecane, Butyl Acrylate/Hydroxypropyl Dimethicone Acrylate Copolymer, Red 28 (CI 45410, Dimethicone Crosspolymer, Cyclopentasiloxane, Propanediol, Vinyl Dimethicone/Methicone Silsesquioxane Crosspolymer, Propylene Carbonate, P Easy-60 Hydrogenated Castor Oil, Yellow 4, Disteadymonium Hectorite, Iron Oxide Black (CI 77499), PEG-60 Hydro Genetized Castor Oil, Isoceteth-10, Yellow No. 4, PEG-60 Hydrogenated Caster Oil, Yellow No. 5, 1, Red 28 (CI 45410), [#37] Dimethicone, Fast Acid Magenta, Methyl Trimethicone, Brilliant Blue FCF, [#38] Dimethicone, Mica, Vp/hexadecenco Polymer, Blue 1 (CI 42090), Dimethicone/Vinyl Dimethicone Crosspolymer, Aluminum Hydroxide, Sunset Yellow FCF (CI 15985), Isododecane, Brilliant Blue FCF (CI 4209, Brilliant Blue FCF (CI 42090), Glyceryl Acrylate /acrylic Acid Copolymer, Methicone, Illicium Verum (Anise) Fruit Extract, Glycerin, Red No. 227, Phenoxyethanol, Sunset Yellow FCF, Lithol Rubine BCA, Titanium Dioxide, Black Iron Oxide, Fast Acid Magenta (CI 17200), 1,2-Hexanediol, Disteardimonium Hectorite, Caprylyl Glycol, Iron Oxide Black, Silica, Red 27 (CI 45410), Butyl Renglycol, Cetyl PEG/PPG-10/1 Dimethicone, Red No. 202, Red No. 201, Lithol Rubine B, Vp/hexade Sencopolymer, Red 7 (CI 15850), Red 33 (CI 17200), Tartrazine, Diamond Isostearyl Maleate, Iron Oxide Yellow, Fragrance, Lithol Rubine B (CI 15850), Ethylhexylglycerin, Cetyl Pig/p P P-10/1 Dimethicone, [#35] Dimethicone, Yellow 6 (CI 15985), Phloxine B, [#36] Dimethicone, [#39] Dimethicone, Red No. 104 (1), Blue No. 1, Iron Oxide Red (CI 77491), Isoceteth-25, Vinyl Dimethicone/ Methicone Silsesquioxane Crosspolymer, Purified Water, [#29 Cocoa Nude]: Dimethicone, Vinyl Dimethicone/methicone Silsesquioxane Crosspolymer, [#31 Wine Nude]: Dimethicone, Pentylene Glycol Lycol, Dimethicone, Red 104 (1), VP/Hexadecene Copolymer, Tartrazine (CI 19140), [#30 Classic Nude]: Dimethicone, Silica Dimethyl Silylate, Iron Oxide Red, Butylene Glycol, Diisostearyl Malate",,,,,,,,,,,,2025-06-21T16:30:37+02:00,
9751263805781,ETUDE,Glow Fixing Tint #02 Mellow Pink,M,14.9,"Découvrez ce fard à lèvres innovant qui fusionne les avantages d'une teinture à lèvres longue tenue avec l'éclat d'un gloss. Sa formule unique offre une couleur vive et durable qui résiste aux transferts et aux frottements, laissant vos lèvres fraîches et éclatantes toute la journée. ",,"WATER / AQUA / EAU, TRIMETHYLSILOXYPHENYL DIMETHICONE, OCTYLDODECANOL, BIS-BEHENYL/ISOSTEARYL/PHYTOSTERYL DIMER DILINOLEYL DIMER DILINOLEATE, POLYAMIDE-8, DIISOSTEARYL MALATE, POLYSORBATE 60, BUTYLENE GLYCOL, CETYL ALCOHOL, GLYCERIN, SORBITAN SESQUIOLEATE, ALCOHOL DENAT., HYDROXYETHYL ACRYLATE/SODIUM ACRYLOYLDIMETHYL TAURATE COPOLYMER, TITANIUM DIOXIDE (CI 77891), COCO-CAPRYLATE/CAPRATE, 1,2-HEXANEDIOL, CASTOR OIL/IPDI COPOLYMER, CAPRYLYL GLYCOL, CAPRYLIC/CAPRIC/SUCCINIC TRIGLYCERIDE, ETHYLHEXYLGLYCERIN, CAPRYLIC/CAPRIC TRIGLYCERIDE, YELLOW 6 (CI 15985), SORBITAN ISOSTEARATE, RED 33 (CI 17200), TOCOPHEROL, DEHYDROACETIC ACID, SODIUM PHYTATE, POLYACRYLATE-13, FRAGRANCE / PARFUM, POLYISOBUTENE, HYDROLYZED HYALURONIC ACID, PENTAERYTHRITYL TETRA-DI-T-BUTYL HYDROXYHYDROCINNAMATE, POLYSORBATE 20, BLUE 1 (CI 42090), RUBUS IDAEUS (RASPBERRY) LEAF EXTRACT",,,,True,,,,,,,,2025-06-21T17:05:32+02:00,
9813910585685,ROMAND,Dewyful Water Tint #02 Salty Peach,M,13.9,"Un encre à lèvres facile à appliquer adaptées à un usage quotidien. Crée de la brillance et une couleur intense en appliquant plusieurs couches.
Offre une finition vibrante et rosée.",5 gr,"Water, Bis-Diglyceryl Polyacyladipate-2, Glycerin, Diphenyl Dimethicone, Diphenylsiloxy Phenyl Trimethicone, Polyglycerin-3, Diisostearyl Malate, Hydrogenated Polyisobutene, Polybutene, Trimethylsiloxyphenyl Dimethicone, Alcohol Denat., Polysorbate 60, Isononyl Isononanoate, Pentylene Glycol, Hydroxyethyl Acrylate/Sodium Acryloyldimethyl Taurate Copolymer, Glyceryl Stearate, PEG-100 Stearate, Squalane, Phenoxyethanol, Lauryl PEG-10 Tris(Trimethylsiloxy)silylethyl Dimethicone, Fragrance, Yellow 6 (CI 15985), Titanium Dioxide (CI 77891), Ethylhexylglycerin, Dextrin, Stevioside, Sorbitan Isostearate, Trisodium Ethylenediamine Disuccinate, Red 33 (CI 17200), Polyglyceryl-2 Triisostearate, Iron Oxides (CI 77499), Blue 1 Lake (CI 42090), Red 28 (CI 45410), Aluminum Hydroxide, Ammonium Polyacrylate, Butylene Glycol, Blue 1 (CI 42090), Tocopherol, Lavandula Angustifolia (Lavender) Extract, Origanum Vulgare Flower/Leaf/Stem Extract, Rosmarinus Officinalis (Rosemary) Extract, Thymus Vulgaris (Thyme) Extract",,,,,,,,,,,,2025-06-21T17:05:43+02:00,
9717561983317,COSRX,Full Fit Propolis Synergy Toner,P,16.9,"Le Full Fit Propolis Synergy Toner de COSRX hydrate, apaise et nourrit la peau, tout en unifiant le teint grâce à la propolis, au miel, à la glycérine et à l'acide hyaluronique.",150 ml,"Propolis Extract, Honey Extract, Butylene Glycol, 1,2-Hexanediol, Glycerin, Betaine, Cassia Obtusifolia Seed Extract, Panthenol, Polyglyceryl-10 Laurate, Polyglyceryl-10 Myristate, Ethylhexylglycerin, Sodium Hyaluronate, Hydroxyethyl Acrylate/Sodium Acryloyldimethyl Taurate Copolymer, Caprylic/Capric Triglyceride",4,,,,,True,,,,,,2025-06-21T17:20:27+02:00,
9904752165205,ISNTREE,Hyper Retinol Ex 1.0 Serum,P,19.95,Formulé avec 5 types de peptides pour renforcer la barrière cutanée et améliorer la fermeté de la peau.,20 ml,"Water, Butylene Glycol, Glycerin, Niacinamide, Dibutyl Adipate, Caprylic/Capric Triglyceride, Bakuchiol(0.6%), Ammonium Acryloyldimethyltaurate/VP Copolymer, 1,2-Hexanediol, Hydrogenated Lecithin, Betaine, Hydroxyacetophenone, Retinyl Palmitate(0.3%), Sodium Stearoyl Glutamate, Tocopherol, Retinol(0.1%), Allantoin, Panthenol, Polysorbate 20, Adenosine, Cetearyl Alcohol, Disodium EDTA, Stearic Acid, Dipropylene Glycol, Hydroxypropyl Cyclodextrin, Polydextrose, Ceramide NP, Asiaticoside, Madecassic Acid, Asiatic Acid, Ceramide NS, Cholesterol, Phytosphingosine, Ferulic Acid, Ceramide AS, Ceramide AP, Copper Tripeptide-1, Acetyl Hexapeptide-8, Palmitoyl Pentapeptide-4, Palmitoyl Tetrapeptide-7, Palmitoyl Tripeptide-1, Ceramide EOP",7,,,,,,,True,True,True,,2025-06-21T17:20:42+02:00,
9730308571477,MARY & MAY,Silicone Brush Large,M,3.9,"Un pinceau en silicone conçu pour une application lisse et hygiénique des masques pour le visage. Fabriqué en matériau silicone doux, il permet d’appliquer et de retirer le masque sans irritation.",,,,,,,,,,,,,,2025-06-21T18:05:25+02:00,
9730308604245,UNLEASHIA,Mood Shower Face Palette No. 100 Ballerina Shower,M,22.9,"Que ce soit pour illuminer vos yeux, ajouter un touché de couleur aux joues ou ajouter un éclat subtil à votre teint, cette palette est un must-have pour toute routine de maquillage !",,"[Tights] Calcium Titanium Borosilicate, Mica, Titanium Dioxide (CI 77891), Talc, Synthetic Fluorphlogopite, Phenyl Trimethicone, Triethylhexanoin, Zinc Stearate, Diisostearyl Malate, Bis-Behenyl/Isostearyl/Phytosteryl Dimer Dilinoleyl Dimer Dilinoleate, Hydrogenated Polyisobutene, Methyl Methacrylate Crosspolymer, Nylon-12, Ethylhexylglycerin, Glyceryl Caprylate, Tin Oxide [Blue Beam] Calcium Titanium Borosilicate, Mica, Titanium Dioxide (CI 77891), Talc, Phenyl Trimethicone, Triethylhexanoin, Calcium Aluminum Borosilicate, Diisostearyl Malate, Zinc Stearate, Synthetic Fluorphlogopite, Bis-Behenyl/Isostearyl/Phytosteryl Dimer Dilinoleyl Dimer Dilinoleate, Hydrogenated Polyisobutene, Nylon-12, Methyl Methacrylate Crosspolymer, Ethylhexylglycerin, Tin Oxide, Glyceryl Caprylate, Ferric Ferrocyanide (CI 77510), Iron Oxides (CI 77491) [Turn Out] Calcium Titanium Borosilicate, Calcium Aluminum Borosilicate, Mica, Talc, Phenyl Trimethicone, Titanium Dioxide (CI 77891), Triethylhexanoin, Diisostearyl Malate, Zinc Stearate, Bis-Behenyl/Isostearyl/Phytosteryl Dimer Dilinoleyl Dimer Dilinoleate, Hydrogenated Polyisobutene, Methyl Methacrylate Crosspolymer, Nylon-12, Iron Oxides (CI 77491), Ethylhexylglycerin, Tin Oxide, Glyceryl Caprylate [Purple Stage] Calcium Titanium Borosilicate, Mica, Calcium Aluminum Borosilicate, Talc, Titanium Dioxide (CI 77891), Phenyl Trimethicone, Triethylhexanoin, Zinc Stearate, Diisostearyl Malate, Bis-Behenyl/Isostearyl/Phytosteryl Dimer Dilinoleyl Dimer Dilinoleate, Hydrogenated Polyisobutene, Iron Oxides (CI 77491), Nylon-12, Methyl Methacrylate Crosspolymer, Synthetic Fluorphlogopite, Iron Oxides (CI 77499), Ethylhexylglycerin, Tin Oxide, Glyceryl Caprylate, Silica, CI 73360, Triethoxycaprylylsilane [Shadow Play] Mica, Calcium Titanium Borosilicate, Talc, Synthetic Fluorphlogopite, Calcium Aluminum Borosilicate, Titanium Dioxide (CI 77891), Iron Oxides (CI 77491), Phenyl Trimethicone, Triethylhexanoin, Zinc Stearate, Diisostearyl Malate, Iron Oxides (CI 77499), Bis-Behenyl/Isostearyl/Phytosteryl Dimer Dilinoleyl Dimer Dilinoleate, Hydrogenated Polyisobutene, Nylon-12, Methyl Methacrylate Crosspolymer, Ethylhexylglycerin, Glyceryl Caprylate, Tin Oxide",,,True,True,,True,,,,,,2025-06-21T18:15:23+02:00,
9732486365525,BEAUTY OF JOSEON,Glow Replenishing Rice Milk,P,21.9,Ce tonique innovant combine le pouvoir hydratant de l'extrait de riz et des acides aminés dérivés du riz avec une poudre contrôlant le sébum pour nourrir et purifier ta peau en profondeur.,150ml,"Water, Methylpropanediol, Propanediol, 1,2-Hexanediol, Glycerin, Glycereth-26, Polymethyl Methacrylate, Oryza Sativa (Rice) Extract, Coptis Japonica Root Extract, Ulmus Davidiana Root Extract, Amaranthus Caudatus Seed Extract, Ficus Carica (Fig) Fruit Extract, Centella Asiatica Extract, Theobroma Cacao (Cocoa) Seed Extract, Hydrogenated Lecithin, Sodium Hyaluronate, Panthenol, Hydroxyethyl Urea, Aluminum Chlorohydrate, Butylene Glycol, Microcrystalline Cellulose, Sodium Citrate, Kaolin, Ethylhexylglycerin, Dipotassium Glycyrrhizate, Citric Acid, Dextrin, Ceramide NP, Tocopherol, Rice Amino Acids",4,,True,,,True,,,,,,2025-06-23T14:30:40+02:00,
9792984219989,ESFOLIO,Peeling Gel - Green Tea,P,9.9,"Ce gel est un exfoliant enrichi en extrait de thé vert, qui hydrate et apaise la peau irritée, laissant un teint revitalisé et lumineux.
Contient des extraits de fruit de papaye et de romarin pour améliorer l'état de la peau grâce à leur pouvoir nourrissant.",150 ml,"Purified Water, Cellulose, Dipropylene Glycol, Glycerin, Butylene Glycol, Yogurt Extract (300ppm), Royal Jelly Extract, Propolis Extract, Honey Extract (10ppm), Carbomer, Arginine, Polysorbate 80, Xanthan Gum, Hydrated Silica, Disodium EDTA, Chlorphenesin, Ethylhexylglycerin, 1,2-Hexanediol, Fragrance, Benzyl Benzoate",3,,,,,True,,,,True,,2025-06-23T14:30:45+02:00,
