ID,Vendor,Title,Type,Variant Price,custom.moyenne_description,custom.taille,custom.ingredients,custom.routine,custom.info_bestseller,custom.info_cruelty_free,custom.info_vegan,custom.info_clean_beauty,custom.tout_type,custom.peau_grasse,custom.peau_mature,custom.peau_seche,custom.peau_sensible,custom.peau_acneique,updated_at,Variant Compare Price
9751264330069,UNLEASHIA,Glitterpedia Eye Palette NO.2 All of brown,M,29.9,"Une collection de palettes de fards à paupières végétaliens pressés, chacune contenant neuf magnifiques nuances portables dans des finitions scintillantes, chatoyantes et mates.",,"Diisostearyl Malate, Dimethicone, Calcium Titanium Borosilicate, Dimethicone Crosspolymer, Calcium Aluminum Borosilicate, 1,2-Hexanediol, Phenoxyethanol, Tin Oxide, Bis-Diglyceryl Polyacyladipate-2, Acrylates Copolymer, Polyglyceryl-2 Triisostearate, Polypropylene, Silica, Petrolatum, Ethylhexylglycerin, Glyceryl Caprylate, Trimethylpentanediol/Adipic Acid/Glycerin Crosspolymer, Talc, Hydrogenated Poly(C6-14 Olefin), Zinc Stearate, Methyl Methacrylate Crosspolymer, Water, Water [Rosy Nude] Mica (CI 77019), Water [Rose Cookie]: Mica, [Ceremony] Ethylene/VA Copolymer, Purified Water [Mellow] Mica, Titanium Dioxide (CI 77891), Hydrogen Dimethicone, Polyisobutene, Water [Sunset Quartz]: Polybutylene Terephthalate, Water [Soft Lavender] Mica (CI 77019), [Lemon Sherbet]: Polymethylsilsesquioxane, Water [Allium] Mica (CI 77019), Yellow 5 Lake (CI 19140), Water [Mauve Wood] Mica (CI 77019), Water [Mauve Pink] Mica (CI 77019), Polymethylsilsesquioxane, Red 7 Lake (CI 15850), Ethylhexyl Palmitate, Tin Oxide [Crush] Calcium Aluminum Borosilicate, Vinyl Dimethicone/Methicone Silsesquioxane Crosspolymer, Synthetic Fluorphlogopite, Dipentaerythrityl hexahydroxystearate/hexastearate/hexarosinate, Tin Oxide [Apricot Mousse]: Mica, HDI/Trimethylol Hexyllactone Crosspolymer, Polyvinyl Acetate [Prime] (Base Pearl) Polymethylsilsesquioxane, Polyvinyl Acetate [Meek] Mica, Ferric Ferrocyanide, Water [Mojito Gleam]: Mica, Purified Water [Honor] Mica, Purified Water [Moment] Talc, Ferric Ferrocyanide [Stuck] Ethylene/VA Copolymer, Mica, Lauroyl Lysine, Trimethylsiloxysilicate, Lithol Rubine BCA (Point Pearl) Calcium Aluminum Borosilicate, Polyvinyl Acetate, Ferric Ferrocyanide (CI 77510) [Iris] Calcium Titanium Borosilicate, Polyvinyl Acetate [Mirage] Calcium Aluminum Borosilicate, Phenyl trimethicone, Purified Water [Gentle] Calcium Titanium Borosilicate, Sorbitan Sesquioleate, Purified Water [Pound] Mica, Ferric Ferrocyanide (CI 77510), Purified Water [Story] Talc, Water [Tequila & Lime Basil] Talc, Sunset Yellow FCF, Polyvinyl Butyral, Tridecyl Trimellitate, Aluminum Myristate, Ethylene/VA Copolymer, Purified Water [Occult] Ethylene/VA Copolymer, Boron Nitride, Ultramarines (CI 77007), Magnesium/Potassium/Silicon/Fluoride/Hydroxide/Oxide, Purified Water [Trick] Ethylene/VA Copolymer, Iron Oxide Red [Symbol] Ethylene/VA Copolymer, Ultramarines, [Blue Sea Dust] Ethylene/VA Copolymer, Manganise Violet, Purified Water [Balance] Mica, Water [Sun Kissed Coral]: Mica, Octyldodecyl Stearoyl Stearate, Lithol Rubine BCA, Polybutylene Terephthalate, Titanium Dioxide, Phenyl Methicone, Hydrogenated Polyisobutene, Nylon-12, Neopentyl Glycol Diheptanoate, Bis-Behenyl/Isostearyl/Phytosteryl Dimer Dilinoleyl Dimer Dilinoleate, Polyvinyl Acetate [Delight] (Base Pearl) Polymethylsilsesquioxane, Iron Oxide Black, Water [Las Coroladas] Polymethylsilsesquioxane, Palmitic Acid (Point Pearl) Calcium Aluminum Borosilicate, Magnesium Myristate, Water [Plum Brown] Mica (CI 77019), Dimethiconol Stearate, Phytosteryl/Isostearyl/Cetyl/Stearyl/Behenyl Dimer Dilinoleate, Iron Oxides (CI 77491), Tartrazine, [Peony Salt] Calcium Titanium Borosilicate, Iron Oxide Yellow, Polyethylene, Iron Oxides (CI 77499), Water [Vegas Light] Diphenylsiloxy Phenyl Trimethicone, Dipentaerythrityl Hexahydroxystearate/Hexastearate/Hexarosinate, Mica (CI 77019), Purified Water [Grace Calcium Titanium Borosilicate, Water [Haze] Mica (CI 77019), Isostearyl Neopentanoate, Polyvinyl Alcohol, Phenyl Trimethicone, Manganese Violet (CI 77742), Triethoxycaprylylsilane, Water [Burnt Basil]: Mica, Diphenylsiloxy Phenyl Trimethicone, Polyvinyl Acetate [Shining Petal] Mica (CI 77019), Ferric Ferrocyanide (CI 77510) [Cherry Chocolate] Mica (CI 77019), Tin Oxide [Sensual] Calcium Titanium Borosilicate, Tocopheryl Acetate, Iron Oxide Yellow [Orange Gummy Bear]: Polymethylsilsesquioxane, Bis-Behenyl/Isostearyl/Dimer Dilinoleyl Dimer Dilinoleate, [Flash] Ethylene/VA Copolymer, Aluminum Starch Octenylsuccinate, Purified Water, Purified Water [Know-how] Ethylene/VA Copolymer, Water [Veiled Bouquet] Calcium Aluminum Borosilicate, Octyldodecanol, Palmitic Acid, Polyvinyl Acetate [Gleam] (Base Pearl) Calcium Aluminum Borosilicate, Ferric Ferrocyanide (CI 77510) [Purple Moon] Polymethylsilsesquioxane, Polyvinyl Acetate [Tender] Talc, [Refine] Polymethylsilsesquioxane, Tin Oxide [Voy Kombucha]: Mica, Purified Water [Vital] Phytocalcium Titanium Borosilicate, Hexyl Laurate, Water [Lavender Quartz] Calcium Aluminum Borosilicate, Phenylmethicone, Tin Oxide (Point Pearl) Calcium Aluminum Borosilicate, Iron Oxide Red, Tin Oxide [Veiled] Calcium Titanium Borosilicate, Iron Oxides (CI 77492), Caprylic/Capric Triglyceride, Purified Water [Desire] Calcium Aluminum Borosilicate",,,True,True,,True,,,,,,2025-06-28T12:24:00+02:00,
9751264362837,UNLEASHIA,Glitterpedia Eye Palette NO.3 All of coral pink,M,29.9,"Une collection de palettes de fards à paupières végétaliens pressés, chacune contenant neuf magnifiques nuances portables dans des finitions scintillantes, chatoyantes et mates.",,"Diisostearyl Malate, Dimethicone, Calcium Titanium Borosilicate, Dimethicone Crosspolymer, Calcium Aluminum Borosilicate, 1,2-Hexanediol, Phenoxyethanol, Tin Oxide, Bis-Diglyceryl Polyacyladipate-2, Acrylates Copolymer, Polyglyceryl-2 Triisostearate, Polypropylene, Silica, Petrolatum, Ethylhexylglycerin, Glyceryl Caprylate, Trimethylpentanediol/Adipic Acid/Glycerin Crosspolymer, Talc, Hydrogenated Poly(C6-14 Olefin), Zinc Stearate, Methyl Methacrylate Crosspolymer, Water, Water [Rosy Nude] Mica (CI 77019), Water [Rose Cookie]: Mica, [Ceremony] Ethylene/VA Copolymer, Purified Water [Mellow] Mica, Titanium Dioxide (CI 77891), Hydrogen Dimethicone, Polyisobutene, Water [Sunset Quartz]: Polybutylene Terephthalate, Water [Soft Lavender] Mica (CI 77019), [Lemon Sherbet]: Polymethylsilsesquioxane, Water [Allium] Mica (CI 77019), Yellow 5 Lake (CI 19140), Water [Mauve Wood] Mica (CI 77019), Water [Mauve Pink] Mica (CI 77019), Polymethylsilsesquioxane, Red 7 Lake (CI 15850), Ethylhexyl Palmitate, Tin Oxide [Crush] Calcium Aluminum Borosilicate, Vinyl Dimethicone/Methicone Silsesquioxane Crosspolymer, Synthetic Fluorphlogopite, Dipentaerythrityl hexahydroxystearate/hexastearate/hexarosinate, Tin Oxide [Apricot Mousse]: Mica, HDI/Trimethylol Hexyllactone Crosspolymer, Polyvinyl Acetate [Prime] (Base Pearl) Polymethylsilsesquioxane, Polyvinyl Acetate [Meek] Mica, Ferric Ferrocyanide, Water [Mojito Gleam]: Mica, Purified Water [Honor] Mica, Purified Water [Moment] Talc, Ferric Ferrocyanide [Stuck] Ethylene/VA Copolymer, Mica, Lauroyl Lysine, Trimethylsiloxysilicate, Lithol Rubine BCA (Point Pearl) Calcium Aluminum Borosilicate, Polyvinyl Acetate, Ferric Ferrocyanide (CI 77510) [Iris] Calcium Titanium Borosilicate, Polyvinyl Acetate [Mirage] Calcium Aluminum Borosilicate, Phenyl trimethicone, Purified Water [Gentle] Calcium Titanium Borosilicate, Sorbitan Sesquioleate, Purified Water [Pound] Mica, Ferric Ferrocyanide (CI 77510), Purified Water [Story] Talc, Water [Tequila & Lime Basil] Talc, Sunset Yellow FCF, Polyvinyl Butyral, Tridecyl Trimellitate, Aluminum Myristate, Ethylene/VA Copolymer, Purified Water [Occult] Ethylene/VA Copolymer, Boron Nitride, Ultramarines (CI 77007), Magnesium/Potassium/Silicon/Fluoride/Hydroxide/Oxide, Purified Water [Trick] Ethylene/VA Copolymer, Iron Oxide Red [Symbol] Ethylene/VA Copolymer, Ultramarines, [Blue Sea Dust] Ethylene/VA Copolymer, Manganise Violet, Purified Water [Balance] Mica, Water [Sun Kissed Coral]: Mica, Octyldodecyl Stearoyl Stearate, Lithol Rubine BCA, Polybutylene Terephthalate, Titanium Dioxide, Phenyl Methicone, Hydrogenated Polyisobutene, Nylon-12, Neopentyl Glycol Diheptanoate, Bis-Behenyl/Isostearyl/Phytosteryl Dimer Dilinoleyl Dimer Dilinoleate, Polyvinyl Acetate [Delight] (Base Pearl) Polymethylsilsesquioxane, Iron Oxide Black, Water [Las Coroladas] Polymethylsilsesquioxane, Palmitic Acid (Point Pearl) Calcium Aluminum Borosilicate, Magnesium Myristate, Water [Plum Brown] Mica (CI 77019), Dimethiconol Stearate, Phytosteryl/Isostearyl/Cetyl/Stearyl/Behenyl Dimer Dilinoleate, Iron Oxides (CI 77491), Tartrazine, [Peony Salt] Calcium Titanium Borosilicate, Iron Oxide Yellow, Polyethylene, Iron Oxides (CI 77499), Water [Vegas Light] Diphenylsiloxy Phenyl Trimethicone, Dipentaerythrityl Hexahydroxystearate/Hexastearate/Hexarosinate, Mica (CI 77019), Purified Water [Grace Calcium Titanium Borosilicate, Water [Haze] Mica (CI 77019), Isostearyl Neopentanoate, Polyvinyl Alcohol, Phenyl Trimethicone, Manganese Violet (CI 77742), Triethoxycaprylylsilane, Water [Burnt Basil]: Mica, Diphenylsiloxy Phenyl Trimethicone, Polyvinyl Acetate [Shining Petal] Mica (CI 77019), Ferric Ferrocyanide (CI 77510) [Cherry Chocolate] Mica (CI 77019), Tin Oxide [Sensual] Calcium Titanium Borosilicate, Tocopheryl Acetate, Iron Oxide Yellow [Orange Gummy Bear]: Polymethylsilsesquioxane, Bis-Behenyl/Isostearyl/Dimer Dilinoleyl Dimer Dilinoleate, [Flash] Ethylene/VA Copolymer, Aluminum Starch Octenylsuccinate, Purified Water, Purified Water [Know-how] Ethylene/VA Copolymer, Water [Veiled Bouquet] Calcium Aluminum Borosilicate, Octyldodecanol, Palmitic Acid, Polyvinyl Acetate [Gleam] (Base Pearl) Calcium Aluminum Borosilicate, Ferric Ferrocyanide (CI 77510) [Purple Moon] Polymethylsilsesquioxane, Polyvinyl Acetate [Tender] Talc, [Refine] Polymethylsilsesquioxane, Tin Oxide [Voy Kombucha]: Mica, Purified Water [Vital] Phytocalcium Titanium Borosilicate, Hexyl Laurate, Water [Lavender Quartz] Calcium Aluminum Borosilicate, Phenylmethicone, Tin Oxide (Point Pearl) Calcium Aluminum Borosilicate, Iron Oxide Red, Tin Oxide [Veiled] Calcium Titanium Borosilicate, Iron Oxides (CI 77492), Caprylic/Capric Triglyceride, Purified Water [Desire] Calcium Aluminum Borosilicate",,,True,True,,True,,,,,,2025-06-28T12:24:30+02:00,
9717166408021,ROMAND,Better Than Palette - 03 Rosebud Garden,M,26.9,"Ces palettes sont parfaites pour celles qui cherchent à varier les looks tout au long de l'année, avec des couleurs qui s’adaptent à chaque saison tout en ajoutant une touche de nature et de fraîcheur à votre routine beauté.",10 Teintes,"Titanium Dioxide (CI 77891), Nylon-12, Magnesium Myristate, Propanediol, Mica (CI 77019), Methylpropanediol, Carmine (CI 75470), Silica, Magnesium Stearate, Octyldodecyl Stearoyl Stearate, Triethoxycaprylylsilane, Phenyl Trimethicone, Diisostearyl Malate, Water, Water [H - Mildy Wood] Mica (CI 77019), Sorbitan Olivate, Water [B - Rosy Glow] Calcium Aluminum Borosilicate, Water [H - Cool Bay] Talc, Water [E - Earthy Glam] Polybutylene Terephthalate, Polyglyceryl-2 Triisostearate, Diglyceryl Sebacate/Isopalmitate, Yellow 5 Lake (CI 19140), Water [I - Mauve Silhouette] Talc, Iron Oxide Yellow (CI 77492) [B - Glaring Sun] Polybutylene Terephthalate, Water [G - Soft Dream] Talc, Polymethylsilsesquioxane, Food Yellow 3 (CI 15985), [F - Cotton Beige] Talc, [A - Dew Drop] Polybutylene Terephthalate, Water [J - Soft Black] Iron Oxide Black (CI 77499), Water [G - Fog Hugging] Talc, Water [D - Purple Dust] Talc, Synthetic Fluorphlogopite, Polyurethane-11, Propylene Carbonate, Aluminum Distearate, Water [D - Burny Brown] Talc, Polyethylene Terephthalate, Iron Oxide Black (CI 77499), Water [I - Maroon Brown] Talc, Water [D - Shining Rose] Polybutylene Terephthalate, Hydrogenated Castor Oil Isostearate, Aluminum Powder (CI 77000), Water [F - Shine Dew] Dimethicone, Water [F - Skin Bud] Talc, Water [F - Dry Grey] Talc, Water [B - Sparkling Petal] Polybutylene Terephthalate, [A - Glam Star] Polybutylene Terephthalate, Lauroyl Lysine, Trimethylsiloxysilicate, Dimethicone/Vinyl Dimethicone Crosspolymer, Yellow 6 Lake (CI 15985) [B - Pale Brie] Talc, Water [H - Mood Rose] Talc, Aluminum Hydroxide, Sunset Yellow FCF (CI 15985), Water [F - Champagne Flow] Calcium Titanium Borosilicate, Acid Yellow 23 Aluminum Lake (CI 19140:1), Isododecane, Water [E - Chocolate Mud] Talc, Methicone, Glycerin, Water [C - Peony Blush] Talc, Ferric Ferrocyanide (CI 77510), Polysorbate 20, Water [I - Soft Mauve] Talc, Phenoxyethanol, Pigment Red 57:1 (CI 15850:1), Ferric Ammonium Ferrocyanide (CI 77510), Calcium Titanium Borosilicate, Water [J - Deep Mahogany] Talc, Macadamia Ternifolia Seed Oil, Water [G - Glory Ivory] Polybutylene Terephthalate, Water [B - Soft Beige] Talc, Ethylene/VA Copolymer, Boron Nitride, Ultramarines (CI 77007), Water [G - Bud Beige] Talc, Water [E - Purple Fantasy] Polybutylene Terephthalate, Water [E - Orchid Night] Talc, Ultramarines, Water [C - Glazed Gold] Calcium Titanium Borosilicate, Acid Yellow 23 (CI 19140), Tocopherol [G - Shade Beige] Talc, Polybutylene Terephthalate, Maltodextrin, Iron Oxide Yellow (CI 77492) [D - Coral Day] Talc, Water [C - Sunshine Pink] Dimethicone, Tin Oxide (CI 77861), Water [J - Deep Brownie] Talc, Ethylene/Propylene Copolymer, Water [B - Skin Ash] Talc, Disteardimonium Hectorite, Water [H - Goldish Tear] Isododecane, Pentylene Glycol, Water [H - Dusty Grey] Talc, Water [D - Bubble Pink] Talc, Silver (CI 77820), Hydrogenated Polydecene, Water [J - Solid Brown] Talc, Acrylates Copolymer, Sodium Dehydroacetate, Water [H - Mellow Coral] Talc, Neopentyl Glycol Diethylhexanoate, Dimethiconol Stearate, Phytosteryl/Isostearyl/Cetyl/Stearyl/Behenyl Dimer Dilinoleate, Iron Oxides (CI 77491), Methicone [F - Skin Beige] Talc, Water [E - Redish Soil] Talc, Iron Oxides (CI 77499), Ethylhexylglycerin, Dipentaerythrityl Hexahydroxystearate/Hexastearate/Hexarosinate, Isostearyl Neopentanoate, [A - Dazzle Honey] Dimethicone, Sorbitan Stearate, Calcium Sodium Borosilicate, Water [I - Mood Brown] Talc, Water [E - Dusty Land] Talc, [A - Glitter Peak] Polybutylene Terephthalate, Blue 1 Lake (CI 42090), Isohexadecane, DipentaerythritylcHexahydroxystearate/Hexastearate/Hexarosinate, Methyl Methacrylate Crosspolymer, Manganese Violet (CI 77742), Water [H - Nudy Grey] Talc, Water [C - Shining Pampas] Dimethicone, Kaolin, Phenylpropyldimethylsiloxysilicate, Diphenylsiloxy Phenyl Trimethicone, Sorbitan Oleate, Potassium Sorbate, Magnesium Aluminum Silicate, Bis-Diglyceryl Polyacyladipate-2, Water [C - Misty Ground] Mica (CI 77019), Carmine (CI 75470) [D - Cold Sparkle] Bis-Diglyceryl Polyacyladipate-2, Water [J - Sparkling Red] Polybutylene Terephthalate, Sorbitan Sesquiisostearate, Aluminum Starch Octenylsuccinate, [A - Icy Mist] Dimethicone, Water [E - Sunshine Shower] Mica (CI 77019), Iron Oxide Red (CI 77491), Isopropyl Palmitate, Hydrogenated Lecithin, Water [D - Brown Ground] Talc, Acid Yellow 23 Aluminum Lake(CI 19140:1), Hydrogenated Castor Oil Dimer Dilinoleate, Polypropylene, Carmine (CI 75470) [I - Rainbow Bubble] Polybutylene Terephthalate, Water [G - Sand Scent] Talc, Octyldodecanol, [A - Bright Fog] Talc, Triethylhexanoin, Yellow 6 Lake (CI 15985), Water [I - Taupe Brown] Talc, Dimethicone, Water [J - Evening Shade] Talc, Talc, Water [C - Rose Shadow] Talc, Water [J - Umber Wood] Talc, Hexyl Laurate, Polysorbate 80, Shorea Robusta Seed Butter, Water [G - Pink Pampas] Talc, Tartrazine (CI 19140), Red 7 (CI 15850:1), Isopropyl Titanium Triisostearate, Calcium Aluminum Borosilicate, Polybutene, Acrylamide/Sodium Acryloyldimethyltaurate Copolymer, Synthetic Wax, Water [I - Dusk Brown] Talc, Iron Oxide Yellow (CI 77492), Water [F - White Pebble] Talc, Red 30 (CI 73360), [A - Matte Sand] Talc, Water [B - Twinkle Pink] Calcium Titanium Borosilicate, Water [C - Fairy Glitter] Polybutylene Terephthalate, Caprylic/Capric Triglyceride, Iron Oxides (CI 77492), Tricalcium Phosphate",,,,,,True,,,,,,2025-06-28T12:27:11+02:00,
9717166342485,ROMAND,Better Than Palette - 06 Peony Nude Garden,M,26.9,"Ces palettes sont parfaites pour celles qui cherchent à varier les looks tout au long de l'année, avec des couleurs qui s’adaptent à chaque saison tout en ajoutant une touche de nature et de fraîcheur à votre routine beauté.",10 Teintes,"Titanium Dioxide (CI 77891), Nylon-12, Magnesium Myristate, Propanediol, Mica (CI 77019), Methylpropanediol, Carmine (CI 75470), Silica, Magnesium Stearate, Octyldodecyl Stearoyl Stearate, Triethoxycaprylylsilane, Phenyl Trimethicone, Diisostearyl Malate, Water, Water [H - Mildy Wood] Mica (CI 77019), Sorbitan Olivate, Water [B - Rosy Glow] Calcium Aluminum Borosilicate, Water [H - Cool Bay] Talc, Water [E - Earthy Glam] Polybutylene Terephthalate, Polyglyceryl-2 Triisostearate, Diglyceryl Sebacate/Isopalmitate, Yellow 5 Lake (CI 19140), Water [I - Mauve Silhouette] Talc, Iron Oxide Yellow (CI 77492) [B - Glaring Sun] Polybutylene Terephthalate, Water [G - Soft Dream] Talc, Polymethylsilsesquioxane, Food Yellow 3 (CI 15985), [F - Cotton Beige] Talc, [A - Dew Drop] Polybutylene Terephthalate, Water [J - Soft Black] Iron Oxide Black (CI 77499), Water [G - Fog Hugging] Talc, Water [D - Purple Dust] Talc, Synthetic Fluorphlogopite, Polyurethane-11, Propylene Carbonate, Aluminum Distearate, Water [D - Burny Brown] Talc, Polyethylene Terephthalate, Iron Oxide Black (CI 77499), Water [I - Maroon Brown] Talc, Water [D - Shining Rose] Polybutylene Terephthalate, Hydrogenated Castor Oil Isostearate, Aluminum Powder (CI 77000), Water [F - Shine Dew] Dimethicone, Water [F - Skin Bud] Talc, Water [F - Dry Grey] Talc, Water [B - Sparkling Petal] Polybutylene Terephthalate, [A - Glam Star] Polybutylene Terephthalate, Lauroyl Lysine, Trimethylsiloxysilicate, Dimethicone/Vinyl Dimethicone Crosspolymer, Yellow 6 Lake (CI 15985) [B - Pale Brie] Talc, Water [H - Mood Rose] Talc, Aluminum Hydroxide, Sunset Yellow FCF (CI 15985), Water [F - Champagne Flow] Calcium Titanium Borosilicate, Acid Yellow 23 Aluminum Lake (CI 19140:1), Isododecane, Water [E - Chocolate Mud] Talc, Methicone, Glycerin, Water [C - Peony Blush] Talc, Ferric Ferrocyanide (CI 77510), Polysorbate 20, Water [I - Soft Mauve] Talc, Phenoxyethanol, Pigment Red 57:1 (CI 15850:1), Ferric Ammonium Ferrocyanide (CI 77510), Calcium Titanium Borosilicate, Water [J - Deep Mahogany] Talc, Macadamia Ternifolia Seed Oil, Water [G - Glory Ivory] Polybutylene Terephthalate, Water [B - Soft Beige] Talc, Ethylene/VA Copolymer, Boron Nitride, Ultramarines (CI 77007), Water [G - Bud Beige] Talc, Water [E - Purple Fantasy] Polybutylene Terephthalate, Water [E - Orchid Night] Talc, Ultramarines, Water [C - Glazed Gold] Calcium Titanium Borosilicate, Acid Yellow 23 (CI 19140), Tocopherol [G - Shade Beige] Talc, Polybutylene Terephthalate, Maltodextrin, Iron Oxide Yellow (CI 77492) [D - Coral Day] Talc, Water [C - Sunshine Pink] Dimethicone, Tin Oxide (CI 77861), Water [J - Deep Brownie] Talc, Ethylene/Propylene Copolymer, Water [B - Skin Ash] Talc, Disteardimonium Hectorite, Water [H - Goldish Tear] Isododecane, Pentylene Glycol, Water [H - Dusty Grey] Talc, Water [D - Bubble Pink] Talc, Silver (CI 77820), Hydrogenated Polydecene, Water [J - Solid Brown] Talc, Acrylates Copolymer, Sodium Dehydroacetate, Water [H - Mellow Coral] Talc, Neopentyl Glycol Diethylhexanoate, Dimethiconol Stearate, Phytosteryl/Isostearyl/Cetyl/Stearyl/Behenyl Dimer Dilinoleate, Iron Oxides (CI 77491), Methicone [F - Skin Beige] Talc, Water [E - Redish Soil] Talc, Iron Oxides (CI 77499), Ethylhexylglycerin, Dipentaerythrityl Hexahydroxystearate/Hexastearate/Hexarosinate, Isostearyl Neopentanoate, [A - Dazzle Honey] Dimethicone, Sorbitan Stearate, Calcium Sodium Borosilicate, Water [I - Mood Brown] Talc, Water [E - Dusty Land] Talc, [A - Glitter Peak] Polybutylene Terephthalate, Blue 1 Lake (CI 42090), Isohexadecane, DipentaerythritylcHexahydroxystearate/Hexastearate/Hexarosinate, Methyl Methacrylate Crosspolymer, Manganese Violet (CI 77742), Water [H - Nudy Grey] Talc, Water [C - Shining Pampas] Dimethicone, Kaolin, Phenylpropyldimethylsiloxysilicate, Diphenylsiloxy Phenyl Trimethicone, Sorbitan Oleate, Potassium Sorbate, Magnesium Aluminum Silicate, Bis-Diglyceryl Polyacyladipate-2, Water [C - Misty Ground] Mica (CI 77019), Carmine (CI 75470) [D - Cold Sparkle] Bis-Diglyceryl Polyacyladipate-2, Water [J - Sparkling Red] Polybutylene Terephthalate, Sorbitan Sesquiisostearate, Aluminum Starch Octenylsuccinate, [A - Icy Mist] Dimethicone, Water [E - Sunshine Shower] Mica (CI 77019), Iron Oxide Red (CI 77491), Isopropyl Palmitate, Hydrogenated Lecithin, Water [D - Brown Ground] Talc, Acid Yellow 23 Aluminum Lake(CI 19140:1), Hydrogenated Castor Oil Dimer Dilinoleate, Polypropylene, Carmine (CI 75470) [I - Rainbow Bubble] Polybutylene Terephthalate, Water [G - Sand Scent] Talc, Octyldodecanol, [A - Bright Fog] Talc, Triethylhexanoin, Yellow 6 Lake (CI 15985), Water [I - Taupe Brown] Talc, Dimethicone, Water [J - Evening Shade] Talc, Talc, Water [C - Rose Shadow] Talc, Water [J - Umber Wood] Talc, Hexyl Laurate, Polysorbate 80, Shorea Robusta Seed Butter, Water [G - Pink Pampas] Talc, Tartrazine (CI 19140), Red 7 (CI 15850:1), Isopropyl Titanium Triisostearate, Calcium Aluminum Borosilicate, Polybutene, Acrylamide/Sodium Acryloyldimethyltaurate Copolymer, Synthetic Wax, Water [I - Dusk Brown] Talc, Iron Oxide Yellow (CI 77492), Water [F - White Pebble] Talc, Red 30 (CI 73360), [A - Matte Sand] Talc, Water [B - Twinkle Pink] Calcium Titanium Borosilicate, Water [C - Fairy Glitter] Polybutylene Terephthalate, Caprylic/Capric Triglyceride, Iron Oxides (CI 77492), Tricalcium Phosphate",,,,,,True,,,,,,2025-06-28T12:27:20+02:00,
