ID,Vendor,Title,Type,Variant Price,custom.moyenne_description,custom.taille,custom.ingredients,custom.routine,custom.info_bestseller,custom.info_cruelty_free,custom.info_vegan,custom.info_clean_beauty,custom.tout_type,custom.peau_grasse,custom.peau_mature,custom.peau_seche,custom.peau_sensible,custom.peau_acneique,updated_at,Variant Compare Price
9717166211413,ROMAND,Better Than Cheek - W03 Apricot Milk,M,10.9,"Le fard à joues Better Than Cheek de Romand est un must-have pour les amateurs de maquillage qui recherchent une teinte subtile et fraîche, avec une formule longue tenue et facile à appliquer. Parfait pour un look de tous les jours ou un maquillage de soirée naturel !",,"Talc, Mica (CI 77019), Silica, Boron Nitride, Hexyl Laurate, Dimethicone, Caprylic/Capric Triglyceride, Diphenylsiloxy Phenyl Trimethicone, Magnesium Myristate, Methylpropanediol, Iron Oxide Red (CI 77491), Calcium Carbonate, Dipentaerythrityl Hexahydroxystearate/Hexastearate/Hexarosinate, Propanediol, Iron Oxide Yellow (CI 77492), Iron Oxide Black (CI 77499), Triethoxycaprylylsilane, Methicone, Red 30 (CI 73360), Ultramarines (CI 77007), Yellow 5 Lake (CI 19140), Water",,,,,,True,,,,,,2025-06-15T05:58:32+02:00,
9732486988117,TIRTIR,Mask Fit Red Cushion - 31N French Beige,M,29.9,"Le TIRTIR Mask Fit Red Cushion est donc une excellente option pour celles qui recherchent un fond de teint qui allie maquillage impeccable et soins nourrissants, tout en offrant un fini naturel et lumineux.",,"Water, Cyclopentasiloxane, Titanium Dioxide (CI 77891), Dimethicone, Trimethylsiloxysilicate, Propanediol, Iron Oxides (CI 77492), Diphenylsiloxy Phenyl Trimethicone, Niacinamide, PEG-10 Dimethicone, Synthetic Fluorphlogopite, Isododecane, PEG/PPG-18/18 Dimethicone, 1,2-Hexanediol, Iron Oxides (CI 77491), Magnesium Sulfate, Octyldodecanol, Iron Oxides (CI 77499), Triethoxycaprylylsilane, Stearic Acid, Alumina, Aluminum Hydroxide, Potassium Sorbate, Polyglyceryl-4 Isostearate, Disteardimonium Hectorite, Fragrance(Parfum), Isopropyl Titanium Triisostearate, Adenosine, Trisodium Ethylenediamine Disuccinate, Polymethyl Methacrylate, Haematococcus Pluvialis Oil, Butylene Glycol, Glycerin, Dipropylene Glycol, Polyglyceryl-3 Polydimethylsiloxyethyl Dimethicone, Sodium Palmitoyl Proline, Cetearyl Dimethicone/Vinyl Dimethicone Crosspolymer, Polyhydroxystearic Acid, Hibiscus Sabdariffa Flower Extract, Astaxanthin, Neopentyl Glycol Diethylhexanoate, Rosa Rugosa Flower Extract, Pancratium Maritimum Extract, Nymphaea Alba Flower Extract, Propolis Extract",,,,,,,,,,,,2025-06-15T06:33:15+02:00,
9815257416021,TIRTIR,Mask Fit Red Cushion - 21C Cool Ivory,M,29.9,"Le TIRTIR Mask Fit Red Cushion est donc une excellente option pour celles qui recherchent un fond de teint qui allie maquillage impeccable et soins nourrissants, tout en offrant un fini naturel et lumineux.",,"Water, Titanium Dioxide (CI 77891), Cyclopentasiloxane, Dimethicone, Trimethylsiloxysilicate, Propanediol, Diphenylsiloxy Phenyl Trimethicone, Niacinamide, PEG-10 Dimethicone, Isododecane, Iron Oxides (CI 77492), Polyglyceryl-3 Polydimethylsiloxyethyl Dimethicone, PEG/PPG-18/18 Dimethicone, 1,2-Hexanediol, Octyldodecanol, Magnesium Sulfate, Disteardimonium Hectorite, Iron Oxides (CI 77491), Aluminum Hydroxide, Stearic Acid, Polyhydroxystearic Acid, Triethoxycaprylylsilane, Alumina, Potassium Sorbate, Polyglyceryl-4 Isostearate, Fragrance(Parfum), Neopentyl Glycol Diethylhexanoate, Iron Oxides (CI 77499), Isopropyl Titanium Triisostearate, Adenosine, Trisodium Ethylenediamine Disuccinate, Polymethyl Methacrylate, Haematococcus Pluvialis Oil, Butylene Glycol, Glycerin, Dipropylene Glycol, Sodium Palmitoyl Proline, Cetearyl Dimethicone/Vinyl Dimethicone Crosspolymer, Hibiscus Sabdariffa Flower Extract, Astaxanthin, Rosa Rugosa Flower Extract, Pancratium Maritimum Extract, Nymphaea Alba Flower Extract, Propolis Extract",,,,,,True,,,,,,2025-06-15T07:55:37+02:00,
9717167685973,UNLEASHIA,Get Loose Glitter Gel - NO.2 Starlit Chaser,M,12.9,"Laissez-vous emporter par l’explosion de couleurs et l’éclat holographique de ces gels pailletés UNLEASHIA Get Loose, pour une expérience de maquillage lumineuse, amusante et pleine de brillance !",,"Get Loose Glitter Gel N°2 Starlit Chaser:

Water, Polybutylene Terephthalate, Diglycerin, Acrylates Copolymer, Ethylene/VA Copolymer, Glycerin, Acrylates/C10-30 alkyl Acrylate Crosspolymer, 1,2-Hexanediol, Tromethamine, Ethylhexylglycerin, Polyglycerin-3, Hydroxyethyl Acrylate/Sodium Acryloyldimethyl Taurate Copolymer, Fragrance, Disodium EDTA, Limonene, Polysorbate 60, Sorbitan Isostearate, Citral, Geraniol, Linalool Get Loose Glitter Gel

Get Loose Glitter Gel N°3 Gold Obsessor:

Water, Polybutylene Terephthalate, Diglycerin, Acrylates Copolymer, Ethylene/VA Copolymer, Glycerin, Acrylates/C10-30 alkyl Acrylate Crosspolymer, Calcium Aluminum Borosilicate, 1,2-Hexanediol, Tromethamine, Ethylhexylglycerin, Polyglycerin-3, Titanium Dioxide (CI 77891), Hydroxyethyl Acrylate/Sodium Acryloyldimethyl Taurate Copolymer, Silica, Fragrance, Disodium EDTA, Limonene, Tin Oxide, Sorbitan Isostearate, Polysorbate 60, Citral, Geraniol, Linalool

Get Loose Glitter Gel N°4 Love Dreamer:

Water, Polybutylene Terephthalate, Diglycerin, Acrylates Copolymer, Ethylene/VA Copolymer, Glycerin, Calcium Titanium Borosilicate, Acrylates/C10-30 alkyl Acrylate Crosspolymer, Titanium Dioxide (CI 77891), 1,2-Hexanediol, Tromethamine, Ethylhexylglycerin, Calcium Aluminum Borosilicate, Synthetic Fluorphlogopite, Polyglycerin-3, Iron Oxides (CI 77491), Hydroxyethyl Acrylate/Sodium Acryloyldimethyl Taurate Copolymer, Fragrance, Disodium EDTA, Silica, Tin Oxide, Limonene, Sorbitan Isostearate, Polysorbate 60, Citral, Geraniol, Linalool",,,True,True,,True,,,,,,2025-06-15T07:56:44+02:00,
9723554824533,AXIS-Y,New Skin Resolution Gel Mask,P,23.9,"Formulé pour illuminer et apaiser la peau, ce masque gel hydrate en profondeur et renforce la barrière cutanée. L'Houttuynia cordata répare et apaise les peaux ternes et irritées, tandis que 2 % de Niacinamide illumine visiblement et unifie le teint. Il améliore l'éclat de la peau, soulage les irritations et maintient une hydratation optimale.",100 ml,"Water, Glycerin, Methylpropanediol, Betaine, 1,2-Hexanediol, Niacinamide, Diglycerin, Centella Asiatica Extract, Ficus Carica (Fig) Fruit Extract, Laminaria Japonica Extract, Eclipta Prostrata Leaf Extract, Melia Azadirachta Leaf Extract, Melia Azadirachta Flower Extract, Theobroma Cacao (Cocoa) Seed Extract, Artemisia Princeps Extract, Dioscorea Japonica Root Extract, Calendula Officinalis Flower Extract, Portulaca Oleracea Extract, Houttuynia Cordata Extract, Spiraea Ulmaria Extract, Hydrogenated Lecithin, Lavandula Angustifolia (Lavender) Oil, Citrus Paradisi (Grapefruit) Peel Oil, Rosmarinus Officinalis (Rosemary) Leaf Oil, Helianthus Annuus (Sunflower) Seed Oil, Anthemis Nobilis Flower Oil, Aniba Rosodora (Rosewood) Wood Oil, Polyglyceryl-10 Laurate, Tromethamine, Carbomer, Panthenol, Houttuynia Cordata Powder, Glyceryl Polymethacrylate, Allantoin, Glyceryl Polyacrylate, Disodium EDTA, Fructooligosaccharides, Dextrin, Beta-Glucan, Ceramide NP, Hydrolyzed Hyaluronic Acid, Madecassoside, Propanediol, Butylene Glycol, Ethylhexylglycerin",5,,,,,True,,,,True,True,2025-06-15T08:36:08+02:00,
9717167620437,UNLEASHIA,Get Loose Glitter Gel - NO.1 Aurora Catcher,M,12.9,"Laissez-vous emporter par l’explosion de couleurs et l’éclat holographique de ces gels pailletés UNLEASHIA Get Loose, pour une expérience de maquillage lumineuse, amusante et pleine de brillance !",,"Get Loose Glitter Gel N°2 Starlit Chaser:

Water, Polybutylene Terephthalate, Diglycerin, Acrylates Copolymer, Ethylene/VA Copolymer, Glycerin, Acrylates/C10-30 alkyl Acrylate Crosspolymer, 1,2-Hexanediol, Tromethamine, Ethylhexylglycerin, Polyglycerin-3, Hydroxyethyl Acrylate/Sodium Acryloyldimethyl Taurate Copolymer, Fragrance, Disodium EDTA, Limonene, Polysorbate 60, Sorbitan Isostearate, Citral, Geraniol, Linalool Get Loose Glitter Gel

Get Loose Glitter Gel N°3 Gold Obsessor:

Water, Polybutylene Terephthalate, Diglycerin, Acrylates Copolymer, Ethylene/VA Copolymer, Glycerin, Acrylates/C10-30 alkyl Acrylate Crosspolymer, Calcium Aluminum Borosilicate, 1,2-Hexanediol, Tromethamine, Ethylhexylglycerin, Polyglycerin-3, Titanium Dioxide (CI 77891), Hydroxyethyl Acrylate/Sodium Acryloyldimethyl Taurate Copolymer, Silica, Fragrance, Disodium EDTA, Limonene, Tin Oxide, Sorbitan Isostearate, Polysorbate 60, Citral, Geraniol, Linalool

Get Loose Glitter Gel N°4 Love Dreamer:

Water, Polybutylene Terephthalate, Diglycerin, Acrylates Copolymer, Ethylene/VA Copolymer, Glycerin, Calcium Titanium Borosilicate, Acrylates/C10-30 alkyl Acrylate Crosspolymer, Titanium Dioxide (CI 77891), 1,2-Hexanediol, Tromethamine, Ethylhexylglycerin, Calcium Aluminum Borosilicate, Synthetic Fluorphlogopite, Polyglycerin-3, Iron Oxides (CI 77491), Hydroxyethyl Acrylate/Sodium Acryloyldimethyl Taurate Copolymer, Fragrance, Disodium EDTA, Silica, Tin Oxide, Limonene, Sorbitan Isostearate, Polysorbate 60, Citral, Geraniol, Linalool",,,True,True,,True,,,,,,2025-06-15T09:51:56+02:00,
9717519122773,BENTON,Honest Cleansing Foam,P,14.9,Ce nettoyant doux est formulé avec des Ingrédients moussants naturels qui rafraîchissent la peau souffrant de stress ou de pollution.,150 ml,"Aqua (Water), Myristic Acid, Glycerin, Lauric Acid, Palmitic Acid, Stearic Acid, Potassium Hydroxide, Butylene Glycol, Camellia Japonica Seed Oil, Sodium Lauroyl Glutamate, Sorbitan Olivate, Polyquaternium-10, Portulaca Oleracea Extract, Camellia Sinensis Leaf Extract, Centella Asiatica Extract, Glycyrrhiza Glabra (Licorice) Root Extract, Chamomilla Recutita (Matricaria) Flower Extract, Polygonum Cuspidatum Root Extract, Rosmarinus Officinalis (Rosemary) Leaf Extract, Scutellaria Baicalensis Root Extract, Althaea Rosea Root Extract, Aloe Barbadensis Leaf Extract, Propanediol,   Hydrolyzed Pea Protein, Phytosterols, Lecithin, Olea Europaea (Olive) Fruit Oil, Squalane, Butyrospermum Parkii (Shea) Butter, Ceramide NP, Zanthoxylum Piperitum Fruit Extract, Pulsatilla Koreana Extract, Usnea Barbata (Lichen) Extract, 1, 2-Hexanediol, Parfum",2,,,True,,True,,,,,,2025-06-15T10:18:55+02:00,
9717439398229,UNLEASHIA,Shaper Defining Eyebrow Pencil  NO.2 Kraft Brown,M,10.9,"Avec ce crayon à sourcils ultra-précis, vous obtiendrez des sourcils parfaitement définis, naturels et élégants, tout en offrant à votre peau un soin apaisant et hydratant. Un outil essentiel pour toutes les amatrices de maquillage !",,"Hydrogenated Soybean Oil, Hydrogenated Coco-Glycerides, Zinc Stearate, Iron Oxides (CI 77492), Hydrogenated Vegetable Oil, Rhus Verniciflua Peel Wax, Mica, Iron Oxides (CI 77491), Copernicia Cerifera (Carnauba) Wax, Chamomilla Recutita (MATRICARIA) Flower Oil, Melaleuca Alternifolia (Tea Tree) Leaf Oil, Rosa Damascena Flower Water, 1,2-Hexanediol, Hydrolyzed Sodium Hyaluronate, Sodium Hyaluronate, Sodium Hyaluronate Crosspolymer, Hydroxypropyltrimonium Hyaluronate, Hydrolyzed Hyaluronic Acid, Hyaluronic Acid, Potassium Hyaluronate, Sodium Acetylated Hyaluronate, Iron Oxides (CI 77499), Titanium Dioxide (CI 77891), Titanium Dioxide (CI 77891) Iron Oxides (CI 77499)",,,True,True,,True,,,,,,2025-06-15T11:06:23+02:00,
9717165818197,TIRTIR,Glow Trial Kit,P,24.9,"vous offre une routine complète pour un éclat radieux contient un nettoyant, un tonique, un sérum et un hydratant format voyage
procure un nettoyage, une hydratation et des soins en profondeur pour une peau douce et éclatante.",65ml,"[Foam Cleansing] Water, Glycerin, Butylene Glycol, Hamamelis Virginiana (Witch Hazel) Extract, 1,2-Hexanediol, Caprylyl Glycol, Glycyrrhiza Glabra (Licorice) Root Extract, Panthenol, Centella Asiatica Extract, Chamomilla Recutita (Matricaria) Flower Extract, Rosmarinus Officinalis (Rosemary) Leaf Extract, Camellia Sinensis Leaf Extract, Scutellaria Baicalensis Root Extract, Polygonum Cuspidatum Root Extract, Polyglyceryl-10 Laurate, Polyglyceryl-10 Myristate, Inonotus Obliquus (Mushroom) Extract, Lactobacillus Ferment Filtrate, Ulmus Davidiana Root Extract, Disodium EDTA, Polyglutamic Acid, Illicium Verum (Anise) Fruit Extract, Ganoderma Lucidum (Mushroom) Extract, Thuja Occidentalis Leaf Extract, Isatis Tinctoria Root Extract, Pelargonium Graveolens Flower Oil [Toner] Water, Glycerin, Beeswax, Olea Europaea (Olive) Fruit Oil, Cetearyl Alcohol, Vinyl Dimethicone, Ozokerite, Glyceryl Stearate, Caprylic/Capric Triglyceride, Macadamia Ternifolia Seed Oil, Polyglutamic Acid, Cetearyl Olivate, Sorbitan Olivate, Methylpropanediol, Carthamus Tinctorius (Safflower) Seed Oil, Glycyrrhiza Glabra (Licorice) Root Extract, Camellia Sinensis Leaf Extract, Rosmarinus Officinalis (Rosemary) Leaf Extract, Centella Asiatica Extract, Chamomilla Recutita (Matricaria) Flower Extract, Scutellaria Baicalensis Root Extract, Polygonum Cuspidatum Root Extract, Citrus Tangerina (Tangerine) Extract, Carbomer, Ammonium Acryloyldimethyltaurate/VP Copolymer, Arginine, Betaine, Xylitol, Trehalose, Hydroxyacetophenone, Pentylene Glycol, Caprylyl Glycol, Butylene Glycol, Butylene Glycol, Disodium EDTA, Fragrance, Citral, Citronellol, Geraniol, Limonene, Linalool [Cream] Water, Glycerin, Methylpropanediol, Betaine, 1,2-hexanediol, Centella Asiatica Extract, Ficus Carica (Fig) Fruit Extract, Laminaria Japonica Extract, Eclipta Prostrata Leaf Extract, Houttuynia Cordata Extract, Melia Azadirachta Leaf Extract, Melia Azadirachta Flower Extract, Melia Azadirachta Flower Extract, Theobroma Cacao (Cocoa) Seed Extract, Solanum Melongena (Eggplant) Fruit Extract, Aloe Barbadensis Flower Extract, Melissa Officinalis Leaf Extract, Origanum Vulgare Flower/leaf/stem Extract, Ocimum Sanctum Leaf Extract, Lavandula Angustifolia (Lavender) Extract, Mentha Rotundifolia Leaf Extract, Curcuma Longa (Turmeric) Root Extract, Corallina Officinalis Extract, Rosmarinus Officinalis (Rosemary) Extract, Ocimum Basilicum (Basil) Leaf Extract, Mentha Viridis (Spearmint) Extract, Tanacetum Vulgare Extract, Artemisia Dracunculus (Tarragon) Leaf/stem Extract, Thymus Vulgaris (Thyme) Extract, Hydrogenated Lecithin, Sodium Hyaluronate, Polyglyceryl-10 Laurate, Carbomer, Tromethamine, Mentha Arvensis Powder, Xanthan Gum, Glyceryl Polymethacrylate, Allantoin, Disodium Edta, Fructooligosaccharides, Dextrin, Beta-glucan, Butylene Glycol, Hydrolyzed Hyaluronic Acid, Ceramide Np, Ethylhexylglycerin [Serum] Centella Asiatica Leaf Water, Glycerin, Butylene Glycol, Hamamelis Virginiana (Witch Hazel) Extract, 1,2-Hexanediol, Arginine, Carbomer, Cetyl Ethylhexanoate, Caprylyl Glycol, Sophora Flavescens Root Extract, Ficus Carica (Fig) Fruit Extract, Ammonium Acryloyldimethyltaurate/VP Copolymer, C12-14 Pareth-12, Polyglyceryl-10 Laurate, Polyglyceryl-10 Myristate, Camellia Sinensis Leaf Extract, Rosmarinus Officinalis (Rosemary) Leaf Extract, Chamomilla Recutita (Matricaria) Flower Extract, Betaine, Centella Asiatica Extract, Glycyrrhiza Glabra (Licorice) Root Extract, Allantoin, Panthenol, Salix Alba (Willow) Bark Extract, Cucumis Sativus (Cucumber) Fruit Extract, Polygonum Cuspidatum Root Extract, Scutellaria Baicalensis Root Extract, Disodium EDTA, Chamaecyparis Obtusa Water, Spirodela Polyrhiza Extract, Alteromonas Ferment Extract, Illicium Verum (Anise) Fruit Extract, Squalane, Phellinus Linteus Extract, Portulaca Oleracea Extract, Sodium PCA, Sodium PCA, Beta-Glucan, Sodium Hyaluronate, Xylitol",,,,True,True,True,,,,,,2025-06-15T11:32:58+02:00,
9717158281557,BENTON,Aloe Soothing mask,P,2.9,"Le masque Benton à 48% d'aloe vera apaise rapidement les peaux sensibles et irritées, sans alcool ni parfum, pour un soin doux et réparateur.",23 gr,"Aloe Barbadensis Leaf Water, Aqua (Water), Camellia Sinensis Leaf Water, Glycerin, Pentylene Glycol, Sodium PCA, Aloe Barbadensis Leaf Extract, Sodium Hyaluronate, Beta-Glucan, Cucumis Sativus (Cucumber) Fruit Extract, Butylene Glycol, Xanthan Gum, Microcrystalline Cellulose, Sodium Gluconate, Betaine, 1,2-Hexanediol, Propanediol, Dipotassium Glycyrrhizate, Cellulose Gum",5,,,,,True,,,,,,2025-06-15T12:11:33+02:00,
9717156381013,ANUA,Heartleaf 77% Soothing Toner MINI,P,6.9,"Le tonique hydratant enrichi en Houttuynia Cordata et en ingrédients EWG Green Grade apaise et hydrate les peaux sensibles, tout en rétablissant l'équilibre naturel de la peau.
",40 ml,"Heartleaf Extract(77%), Water, 1,2-Hexanediol, Glycerin, Betaine, Panthenol, Saccharum Officinarum (Sugar Cane) Extract, Portulaca Oleracea Extract, Butylene Glycol, Vitex Agnus-Castus Extract, Chamomilla Recutita (Matricaria) Flower, Arctium Lappa Root Extract, Phellinus Linteus Extract, Vitis Vinifera (Grape) Fruit Extract, Pyrus Malus (Apple) Fruit Extract, Centella Asiatica Extract, Isopentyldiol, Methylpropanediol, Acrylates/C10-30 Alkyl Acrylate Crosspolymer, Tromethamine, Disodium EDTA

",4,,True,True,,True,True,,True,,,2025-06-15T12:47:50+02:00,
9792983728469,SOME BY MI,Retinol Intense Daily Mask,P,29.9,"Grâce au complexe rétinol présent dans le masque en tissu, vos pores sont affinés et vous obtenez une belle peau rosée. Enrichie de 8 types d'acide hyaluronique et de bakuchiol, cette formule hypoallergénique est parfaite pour tous les types de peau !",30 pièces,"Water, Dipropylene Glycol, Glycerin, Niacinamide, Hydroxyacetophenone, Olea Europaea Fruit Oil, Caprylyl Glycol, Polyglyceryl-10 Laurate, Ethylhexylglycerin, Adenosine, 1,2-Hexanediol, Arginine, Xanthan Gum, Carbomer, Polyglyceryl-3 Methylglucose Distearate, Sodium Hyaluronate, Glyceryl Stearate SE, Methyl Glucose Sesquistearate, Diethylhexyl Sodium Sulfosuccinate, Caprylic/Capric Triglyceride, Dipotassium Glycyrrhizate, Bakuchiol, Butylene Glycol, Octyldodecanol, Polyglyceryl-4 Oleate, Sucrose Palmitate, Pineapple Sativus Fruit Extract, Maltodextrin, Hydrolyzed Vegetable Protein, Hydrogenated Lecithin, Solan um Melongena Fruit Extract, Glycine Soja Oil, Retinol, Retinal, Hydrolyzed Hyaluronic Acid, Hyaluronic Acid, Sodium Hyaluronate Crosspolymer, Hydroxypropyltrimonium Hyaluronate, Potassium Hyaluronate, Hydrolyzed Sodium Hyaluronate, Pentylene Glycol, Sodium Acetylated Hyaluronate, Disodium EDTA, Fragrance, Hydroxycitronellal",5,,True,,,True,,,,,,2025-06-15T13:33:44+02:00,
9717165195605,JUICE TO CLEANSE,Clean Butter Cold Pressed Bar,P,13.9,"Avec le Clean Butter Cold Pressed Bar, vous prenez soin de votre peau tout en faisant un geste pour la planète. Une approche respectueuse de la nature, tout en obtenant une peau douce, nourrie et éclatante.",120 gr,"Cocos Nucifera (Coconut) Oil, Aqua (Water/Eau), Helianthus Annuus (Sunflower) Seed Oil, Sodium Hydroxide, Butyrospermum Parkii (Shea) Butter, Camellia Japonica Seed Oil, Mangifera Indica (Mango) Seed Butter, Olea Europaea (Olive) Fruit Oil, Simmondsia Chinensis (Jojoba) Seed Oil, Argania Spinosa Kernel Oil, Cucurbita Pepo (Pumpkin) Powder, Oenothera Biennis (Evening Primrose) Oil, Sodium Hyaluronate, Ceramide NP, Phospholipids, Hydrogenated Lecithin, Centella Asiatica Extract, Citrus Unshiu Fruit Extract, Houttuynia Cordata Extract, Carica Papaya (Papaya) Fruit Extract, Citrus Aurantium Bergamia Fruit Oil, Citrus Aurantium Dulcis (Orange) Peel Oil Expressed, Citrus Paradisi (Grapefruit) Peel Oil, Glycerin, Butylene Glycol, Caprylyl Glycol, Caprylic/Capric Triglyceride, 1,2-Hexanediol, Diethoxyethyl Succinate, Linalool, Limonene.",,,,True,,,True,,,,,2025-06-15T13:58:55+02:00,
9717519024469,AROMATICA,Tea Tree Balancing Foaming Cleanser,P,19.9,"Ce nettoyant délicat à l'aloe vera et à l'huile d'arbre à thé élimine les impuretés tout en régulant la production de sébum, sans dessécher la peau. Enrichi en bardane et en huiles essentielles de géranium, il hydrate, apaise et aide à contrôler les imperfections.",180 ml,"Aloe Barbadensis Leaf Extract, Glycerin, Stearic Acid, Lauric Acid, Potassium Hydroxide, Sodium Cocoamphoacetate, Myristic Acid, Glyceryl Stearate, Sorbitan Olivate, Melaleuca Alternifolia (Tea Tree) Leaf Extract, **Arctium Lappa(Burdock) Root Extract, **Symphytum Officinale(Comfrey) Root Extract, Allantoin, *Tocopherol, Caprylyl Glycol, Phenethyl Alcohol, ?Melaleuca Alternifolia Leaf Oil, ?Pelargonium Roseum Leaf Oil, ?Citrus Aurantium Amara Leaf/Twig Oil, ?Citrus Aurantium Bergamia Fruit Oil *Ecocert Certified Natural **From Organic Farming ?Pure Essential Oil.",2,,True,True,,,True,,,,True,2025-06-15T14:30:12+02:00,
9717561917781,BENTON,Deep green tea Toner,P,17.9,"Avec ce tonique au thé vert, votre peau sera plus fraîche, apaisée, et parfaitement matifiée, idéale pour contrôler l'excès de sébum et afficher un teint net et éclatant.",150 ml,"Camellia Sinensis Leaf Water(50%), Aqua (Water), Butylene Glycol, 1,2-Hexanediol, Glycerin, Pentylene Glycol, Sodium Hyaluronate, Centella Asiatica Extract, Houttuynia Cordata Extract, Camellia Sinensis Leaf Extract, Camellia Sinensis Seed Extract, Camellia Sinensis Root Extract, Salix Nigra (Willow) Bark Extract, Punica Granatum Fruit Extract, Betaine",4,,,,,True,,,,,,2025-06-15T14:55:02+02:00,
9761927922005,BENTON,Deep Green Tea Serum,P,17.9,"Sérum délicat avec un PH légèrement acide, formulé avec une teneur élevée en thé vert et en acide hyaluronique.",30 ml,"Eau de feuille de Camellia Sinensis, Aqua (Eau), Glycérine, Butylène Glycol, Pentylène Glycol, 1, 2-Hexanediol, Extrait de Feuille de Camellia Sinensis, Extrait de Racine de Camellia Sinensis, Extrait de Graine de Camellia Sinensis, Bétaïne, Panthénol, Extrait de Houttuynia Cordata, Centella Extrait asiatique, extrait d'écorce de Salix Nigra (saule), extrait d'écorce de Salix Alba (saule), extrait de fruit de Punica Granatum, hyaluronate de sodium, hyaluronate de sodium hydrolysé, acide hyaluronique, biosaccharide gomme-1, gomme de cellulose, caprylylglycolhee-camellia gelée, Triglycéride Caprylique / Caprique, Tocophérol, Huile de Graine d'Helianthus Annuus (Tournesol), Polyglycéryl-10 Laurate, Propanediol",7,,,True,,True,True,,,True,,2025-06-15T16:13:37+02:00,
9813944172885,ETUDE,Glow Fixing Tint #03 Dewy Fig,M,14.9,"Découvrez ce fard à lèvres innovant qui fusionne les avantages d'une teinture à lèvres longue tenue avec l'éclat d'un gloss. Sa formule unique offre une couleur vive et durable qui résiste aux transferts et aux frottements, laissant vos lèvres fraîches et éclatantes toute la journée. ",,"WATER / AQUA / EAU, TRIMETHYLSILOXYPHENYL DIMETHICONE, OCTYLDODECANOL, BIS-BEHENYL/ISOSTEARYL/PHYTOSTERYL DIMER DILINOLEYL DIMER DILINOLEATE, POLYAMIDE-8, DIISOSTEARYL MALATE, POLYSORBATE 60, BUTYLENE GLYCOL, CETYL ALCOHOL, GLYCERIN, SORBITAN SESQUIOLEATE, ALCOHOL DENAT., HYDROXYETHYL ACRYLATE/SODIUM ACRYLOYLDIMETHYL TAURATE COPOLYMER, TITANIUM DIOXIDE (CI 77891), COCO-CAPRYLATE/CAPRATE, 1,2-HEXANEDIOL, CASTOR OIL/IPDI COPOLYMER, CAPRYLYL GLYCOL, CAPRYLIC/CAPRIC/SUCCINIC TRIGLYCERIDE, YELLOW 6 (CI 15985), ETHYLHEXYLGLYCERIN, CAPRYLIC/CAPRIC TRIGLYCERIDE, SORBITAN ISOSTEARATE, RED 33 (CI 17200), TOCOPHEROL, DEHYDROACETIC ACID, SODIUM PHYTATE, POLYACRYLATE-13, FRAGRANCE / PARFUM, POLYISOBUTENE, HYDROLYZED HYALURONIC ACID, PENTAERYTHRITYL TETRA-DI-T-BUTYL HYDROXYHYDROCINNAMATE, POLYSORBATE 20, BLUE 1 (CI 42090), RUBUS IDAEUS (RASPBERRY) LEAF EXTRACT",,,,True,,,,,,,,2025-06-15T16:16:01+02:00,
9738538844501,APIEU,Juicy-Pang Water Blusher #CR02 Persimmon,M,8.9,"Le Juicy Pang Water Blusher est parfait pour celles qui recherchent un teint frais et rosé avec un fini naturel et lumineux. Sa texture légère, sa facilité d'application et sa pigmentation en font un must-have pour un maquillage rapide et facile.",,"Water, Cyclopentasiloxane, Alcohol Denat., Butylene Glycol, Cetyl Ethylhexanoate, Methyl Trimethicone, Talc, Glycerin, Pentylene Glycol, PEG-10 Dimethicone, Triethylhexanoin, Synthetic Fluorphlogopite, Prunus Avium (Sweet Cherry) Fruit Extract, Rosa Damascena (Rose) Flower Water, Ficus Carica (Fig) Fruit Extract, Citrus Aurantium Dulcis (Orange) Peel Oil, Simmondsia Chinensis (Jojoba) Seed Oil, Camellia Oleifera (Tea-Oil Camellia) Seed Oil, Nigella Sativa (Black Cumin) Seed Oil, Punica Granatum (Pomegranate) Seed Oil, Rosa Canina (Dog Rose) Fruit Oil, Vitis Vinifera (Grape) Fruit Extract, Prunus Armeniaca (Apricot) Fruit Extract, Vaccinium Angustifolium (Blueberry) Fruit Extract, Fragaria Ananassa (Strawberry) Fruit Extract, Prunus Persica (Peach) Fruit Extract, Rubus Idaeus (Raspberry) Fruit Extract, Pyrus Malus (Apple) Fruit Extract, Citrus Aurantium Dulcis (Orange) Fruit Extract, Diospyros Kaki (Persimmon) Fruit Extract, Juglans Regia (Walnut) Seed Extract, Morus Alba (White Mulberry) Fruit Extract, Punica Granatum (Pomegranate) Extract, Pyrus Communis (Pear) Fruit Extract, Solanum Lycopersicum (Tomato) Fruit Extract, Methyl Methacrylate Crosspolymer, Polypropylsilsesquioxane, Trimethylsiloxysilicate, Magnesium Sulfate, Cetyl PEG/PPG-10/1 Dimethicone, Disteardimonium Hectorite, Dimethicone, Dimethicone Crosspolymer, Triethoxycaprylylsilane, Ethylhexylglycerin, 1,2-Hexanediol, Caprylyl Glycol, Octanediol, Disodium EDTA, Phenoxyethanol, Fragrance, Mica (CI 77019), Red Iron Oxide (CI 77491), Titanium Dioxide (CI 77891), Helindone Pink CN (CI 73360), Yellow Iron Oxide (CI 77492)",,,True,,,,,,,,,2025-06-15T16:27:50+02:00,
